{
  "artifactId": "artifact-demo-1",
  "projectId": "project-demo",
  "artifactType": "ChapterCandidate",
  "scope": { "level": "CHAPTER", "chapterId": "chapter-1" },
  "version": 1,
  "schemaVersion": "m0a.artifact.v1",
  "artifactStatus": "CANDIDATE",
  "payload": { "title": "第一章", "content": "你好\n世界" },
  "payloadHash": "0000000000000000000000000000000000000000000000000000000000000000",
  "dependencyRefs": [],
  "provenance": { "createdBy": "test", "commandId": "command-1" },
  "createdAt": "2026-08-24T00:00:00Z"
}
